designation,type,description,source
22215 CCK/W33,Сферический роликовый,Код 15 → d=75 мм; коническое отверстие K и смазочная канавка W33.,ISO/система_обозначений.md
30205,Конический роликовый,"Серия 2, код 05; требует регулировки преднатяга.",ISO/система_обозначений.md
6205,Радиальный шариковый,"Серия 2, ширина 0, код 05 → d=25 мм; базовое исполнение ISO.",ISO/система_обозначений.md
7205 BECBP,Радиально-упорный шариковый,"Угол контакта 40°, код 05; полиамидный сепаратор и повышенная точность.",ISO/система_обозначений.md
NU 305 E C3,Цилиндрический роликовый,"Бурты на наружном кольце, серия 3, код 05; зазор C3.",ISO/система_обозначений.md
